No.     Time           Source                Destination           Protocol Length Info
      1 0.000000       192.168.2.18          192.168.2.37          TCP      176    49281 → 8009 [PSH, ACK] Seq=1 Ack=1 Win=2048 Len=110 TSval=1433162149 TSecr=6320849 [TCP segment of a reassembled PDU]

Frame 1: 176 bytes on wire (1408 bits), 176 bytes captured (1408 bits) on interface en0, id 0
Ethernet II, Src: Apple_52:e7:4f (1c:57:dc:52:e7:4f), Dst: Google_11:45:27 (7c:d9:5c:11:45:27)
Internet Protocol Version 4, Src: 192.168.2.18, Dst: 192.168.2.37
Transmission Control Protocol, Src Port: 49281, Dst Port: 8009, Seq: 1, Ack: 1, Len: 110

No.     Time           Source                Destination           Protocol Length Info
      2 0.007337       192.168.2.37          192.168.2.18          TCP      176    8009 → 49281 [PSH, ACK] Seq=1 Ack=111 Win=277 Len=110 TSval=6321350 TSecr=1433162149 [TCP segment of a reassembled PDU]

Frame 2: 176 bytes on wire (1408 bits), 176 bytes captured (1408 bits) on interface en0, id 0
Ethernet II, Src: Google_11:45:27 (7c:d9:5c:11:45:27), Dst: Apple_52:e7:4f (1c:57:dc:52:e7:4f)
Internet Protocol Version 4, Src: 192.168.2.37, Dst: 192.168.2.18
Transmission Control Protocol, Src Port: 8009, Dst Port: 49281, Seq: 1, Ack: 111, Len: 110

No.     Time           Source                Destination           Protocol Length Info
      3 0.007422       192.168.2.18          192.168.2.37          TCP      66     49281 → 8009 [ACK] Seq=111 Ack=111 Win=2046 Len=0 TSval=1433162157 TSecr=6321350

Frame 3: 66 bytes on wire (528 bits), 66 bytes captured (528 bits) on interface en0, id 0
Ethernet II, Src: Apple_52:e7:4f (1c:57:dc:52:e7:4f), Dst: Google_11:45:27 (7c:d9:5c:11:45:27)
Internet Protocol Version 4, Src: 192.168.2.18, Dst: 192.168.2.37
Transmission Control Protocol, Src Port: 49281, Dst Port: 8009, Seq: 111, Ack: 111, Len: 0

No.     Time           Source                Destination           Protocol Length Info
      4 0.013790       192.168.2.18          35.186.224.43         TLSv1.2  109    Application Data

Frame 4: 109 bytes on wire (872 bits), 109 bytes captured (872 bits) on interface en0, id 0
Ethernet II, Src: Apple_52:e7:4f (1c:57:dc:52:e7:4f), Dst: Sagemcom_ff:a3:b2 (34:5d:9e:ff:a3:b2)
Internet Protocol Version 4, Src: 192.168.2.18, Dst: 35.186.224.43
Transmission Control Protocol, Src Port: 56133, Dst Port: 443, Seq: 1, Ack: 1, Len: 43
Transport Layer Security

No.     Time           Source                Destination           Protocol Length Info
      5 0.025235       35.186.224.43         192.168.2.18          TCP      66     443 → 56133 [ACK] Seq=1 Ack=44 Win=270 Len=0 TSval=3205158683 TSecr=2508387586

Frame 5: 66 bytes on wire (528 bits), 66 bytes captured (528 bits) on interface en0, id 0
Ethernet II, Src: Sagemcom_ff:a3:b2 (34:5d:9e:ff:a3:b2), Dst: Apple_52:e7:4f (1c:57:dc:52:e7:4f)
Internet Protocol Version 4, Src: 35.186.224.43, Dst: 192.168.2.18
Transmission Control Protocol, Src Port: 443, Dst Port: 56133, Seq: 1, Ack: 44, Len: 0

No.     Time           Source                Destination           Protocol Length Info
      6 0.040959       192.168.2.34          192.168.2.255         UDP      56     2008 → 2008 Len=14

Frame 6: 56 bytes on wire (448 bits), 56 bytes captured (448 bits) on interface en0, id 0
Ethernet II, Src: IntelCor_11:80:23 (60:dd:8e:11:80:23), Dst: Broadcast (ff:ff:ff:ff:ff:ff)
Internet Protocol Version 4, Src: 192.168.2.34, Dst: 192.168.2.255
User Datagram Protocol, Src Port: 2008, Dst Port: 2008
Data (14 bytes)

0000  42 43 20 20 39 41 73 68 70 61 6e 2d 50 43         BC  9Ashpan-PC

No.     Time           Source                Destination           Protocol Length Info
      7 0.040960       192.168.2.34          192.168.2.255         UDP      56     2007 → 2007 Len=14

Frame 7: 56 bytes on wire (448 bits), 56 bytes captured (448 bits) on interface en0, id 0
Ethernet II, Src: IntelCor_11:80:23 (60:dd:8e:11:80:23), Dst: Broadcast (ff:ff:ff:ff:ff:ff)
Internet Protocol Version 4, Src: 192.168.2.34, Dst: 192.168.2.255
User Datagram Protocol, Src Port: 2007, Dst Port: 2007
Data (14 bytes)

0000  42 43 20 20 39 41 73 68 70 61 6e 2d 50 43         BC  9Ashpan-PC

No.     Time           Source                Destination           Protocol Length Info
      8 0.053280       35.186.224.43         192.168.2.18          TLSv1.2  106    Application Data

Frame 8: 106 bytes on wire (848 bits), 106 bytes captured (848 bits) on interface en0, id 0
Ethernet II, Src: Sagemcom_ff:a3:b2 (34:5d:9e:ff:a3:b2), Dst: Apple_52:e7:4f (1c:57:dc:52:e7:4f)
Internet Protocol Version 4, Src: 35.186.224.43, Dst: 192.168.2.18
Transmission Control Protocol, Src Port: 443, Dst Port: 56133, Seq: 1, Ack: 44, Len: 40
Transport Layer Security

No.     Time           Source                Destination           Protocol Length Info
      9 0.053367       192.168.2.18          35.186.224.43         TCP      66     56133 → 443 [ACK] Seq=44 Ack=41 Win=2047 Len=0 TSval=2508387626 TSecr=3205158710

Frame 9: 66 bytes on wire (528 bits), 66 bytes captured (528 bits) on interface en0, id 0
Ethernet II, Src: Apple_52:e7:4f (1c:57:dc:52:e7:4f), Dst: Sagemcom_ff:a3:b2 (34:5d:9e:ff:a3:b2)
Internet Protocol Version 4, Src: 192.168.2.18, Dst: 35.186.224.43
Transmission Control Protocol, Src Port: 56133, Dst Port: 443, Seq: 44, Ack: 41, Len: 0

No.     Time           Source                Destination           Protocol Length Info
     10 0.143566       192.168.2.34          192.168.2.255         UDP      56     2008 → 2008 Len=14

Frame 10: 56 bytes on wire (448 bits), 56 bytes captured (448 bits) on interface en0, id 0
Ethernet II, Src: IntelCor_11:80:23 (60:dd:8e:11:80:23), Dst: Broadcast (ff:ff:ff:ff:ff:ff)
Internet Protocol Version 4, Src: 192.168.2.34, Dst: 192.168.2.255
User Datagram Protocol, Src Port: 2008, Dst Port: 2008
Data (14 bytes)

0000  42 43 20 20 39 41 73 68 70 61 6e 2d 50 43         BC  9Ashpan-PC

No.     Time           Source                Destination           Protocol Length Info
     11 0.143568       192.168.2.34          192.168.2.255         UDP      56     2007 → 2007 Len=14

Frame 11: 56 bytes on wire (448 bits), 56 bytes captured (448 bits) on interface en0, id 0
Ethernet II, Src: IntelCor_11:80:23 (60:dd:8e:11:80:23), Dst: Broadcast (ff:ff:ff:ff:ff:ff)
Internet Protocol Version 4, Src: 192.168.2.34, Dst: 192.168.2.255
User Datagram Protocol, Src Port: 2007, Dst Port: 2007
Data (14 bytes)

0000  42 43 20 20 39 41 73 68 70 61 6e 2d 50 43         BC  9Ashpan-PC

No.     Time           Source                Destination           Protocol Length Info
     12 0.155394       104.18.12.33          192.168.2.18          TLSv1.2  93     Application Data

Frame 12: 93 bytes on wire (744 bits), 93 bytes captured (744 bits) on interface en0, id 0
Ethernet II, Src: Sagemcom_ff:a3:b2 (34:5d:9e:ff:a3:b2), Dst: Apple_52:e7:4f (1c:57:dc:52:e7:4f)
Internet Protocol Version 4, Src: 104.18.12.33, Dst: 192.168.2.18
Transmission Control Protocol, Src Port: 443, Dst Port: 56074, Seq: 1, Ack: 1, Len: 27
Transport Layer Security

No.     Time           Source                Destination           Protocol Length Info
     13 0.155618       192.168.2.18          104.18.12.33          TCP      66     56074 → 443 [ACK] Seq=1 Ack=28 Win=2047 Len=0 TSval=3980461332 TSecr=894603975

Frame 13: 66 bytes on wire (528 bits), 66 bytes captured (528 bits) on interface en0, id 0
Ethernet II, Src: Apple_52:e7:4f (1c:57:dc:52:e7:4f), Dst: Sagemcom_ff:a3:b2 (34:5d:9e:ff:a3:b2)
Internet Protocol Version 4, Src: 192.168.2.18, Dst: 104.18.12.33
Transmission Control Protocol, Src Port: 56074, Dst Port: 443, Seq: 1, Ack: 28, Len: 0

No.     Time           Source                Destination           Protocol Length Info
     14 0.245692       192.168.2.34          192.168.2.255         UDP      56     2008 → 2008 Len=14

Frame 14: 56 bytes on wire (448 bits), 56 bytes captured (448 bits) on interface en0, id 0
Ethernet II, Src: IntelCor_11:80:23 (60:dd:8e:11:80:23), Dst: Broadcast (ff:ff:ff:ff:ff:ff)
Internet Protocol Version 4, Src: 192.168.2.34, Dst: 192.168.2.255
User Datagram Protocol, Src Port: 2008, Dst Port: 2008
Data (14 bytes)

0000  42 43 20 20 39 41 73 68 70 61 6e 2d 50 43         BC  9Ashpan-PC

No.     Time           Source                Destination           Protocol Length Info
     15 0.245694       192.168.2.34          192.168.2.255         UDP      56     2007 → 2007 Len=14

Frame 15: 56 bytes on wire (448 bits), 56 bytes captured (448 bits) on interface en0, id 0
Ethernet II, Src: IntelCor_11:80:23 (60:dd:8e:11:80:23), Dst: Broadcast (ff:ff:ff:ff:ff:ff)
Internet Protocol Version 4, Src: 192.168.2.34, Dst: 192.168.2.255
User Datagram Protocol, Src Port: 2007, Dst Port: 2007
Data (14 bytes)

0000  42 43 20 20 39 41 73 68 70 61 6e 2d 50 43         BC  9Ashpan-PC

No.     Time           Source                Destination           Protocol Length Info
     16 0.348205       192.168.2.34          192.168.2.255         UDP      56     2008 → 2008 Len=14

Frame 16: 56 bytes on wire (448 bits), 56 bytes captured (448 bits) on interface en0, id 0
Ethernet II, Src: IntelCor_11:80:23 (60:dd:8e:11:80:23), Dst: Broadcast (ff:ff:ff:ff:ff:ff)
Internet Protocol Version 4, Src: 192.168.2.34, Dst: 192.168.2.255
User Datagram Protocol, Src Port: 2008, Dst Port: 2008
Data (14 bytes)

0000  42 43 20 20 39 41 73 68 70 61 6e 2d 50 43         BC  9Ashpan-PC

No.     Time           Source                Destination           Protocol Length Info
     17 0.348428       192.168.2.34          192.168.2.255         UDP      56     2007 → 2007 Len=14

Frame 17: 56 bytes on wire (448 bits), 56 bytes captured (448 bits) on interface en0, id 0
Ethernet II, Src: IntelCor_11:80:23 (60:dd:8e:11:80:23), Dst: Broadcast (ff:ff:ff:ff:ff:ff)
Internet Protocol Version 4, Src: 192.168.2.34, Dst: 192.168.2.255
User Datagram Protocol, Src Port: 2007, Dst Port: 2007
Data (14 bytes)

0000  42 43 20 20 39 41 73 68 70 61 6e 2d 50 43         BC  9Ashpan-PC

No.     Time           Source                Destination           Protocol Length Info
     18 0.452530       192.168.2.34          192.168.2.255         UDP      56     2008 → 2008 Len=14

Frame 18: 56 bytes on wire (448 bits), 56 bytes captured (448 bits) on interface en0, id 0
Ethernet II, Src: IntelCor_11:80:23 (60:dd:8e:11:80:23), Dst: Broadcast (ff:ff:ff:ff:ff:ff)
Internet Protocol Version 4, Src: 192.168.2.34, Dst: 192.168.2.255
User Datagram Protocol, Src Port: 2008, Dst Port: 2008
Data (14 bytes)

0000  42 43 20 20 39 41 73 68 70 61 6e 2d 50 43         BC  9Ashpan-PC

No.     Time           Source                Destination           Protocol Length Info
     19 0.452532       192.168.2.34          192.168.2.255         UDP      56     2007 → 2007 Len=14

Frame 19: 56 bytes on wire (448 bits), 56 bytes captured (448 bits) on interface en0, id 0
Ethernet II, Src: IntelCor_11:80:23 (60:dd:8e:11:80:23), Dst: Broadcast (ff:ff:ff:ff:ff:ff)
Internet Protocol Version 4, Src: 192.168.2.34, Dst: 192.168.2.255
User Datagram Protocol, Src Port: 2007, Dst Port: 2007
Data (14 bytes)

0000  42 43 20 20 39 41 73 68 70 61 6e 2d 50 43         BC  9Ashpan-PC

No.     Time           Source                Destination           Protocol Length Info
     20 0.452532       192.168.2.1           239.255.255.250       SSDP     368    NOTIFY * HTTP/1.1 

Frame 20: 368 bytes on wire (2944 bits), 368 bytes captured (2944 bits) on interface en0, id 0
Ethernet II, Src: Sagemcom_ff:a3:b2 (34:5d:9e:ff:a3:b2), Dst: IPv4mcast_7f:ff:fa (01:00:5e:7f:ff:fa)
Internet Protocol Version 4, Src: 192.168.2.1, Dst: 239.255.255.250
User Datagram Protocol, Src Port: 1900, Dst Port: 1900
Simple Service Discovery Protocol

No.     Time           Source                Destination           Protocol Length Info
     21 0.553081       192.168.2.34          192.168.2.255         UDP      56     2008 → 2008 Len=14

Frame 21: 56 bytes on wire (448 bits), 56 bytes captured (448 bits) on interface en0, id 0
Ethernet II, Src: IntelCor_11:80:23 (60:dd:8e:11:80:23), Dst: Broadcast (ff:ff:ff:ff:ff:ff)
Internet Protocol Version 4, Src: 192.168.2.34, Dst: 192.168.2.255
User Datagram Protocol, Src Port: 2008, Dst Port: 2008
Data (14 bytes)

0000  42 43 20 20 39 41 73 68 70 61 6e 2d 50 43         BC  9Ashpan-PC

No.     Time           Source                Destination           Protocol Length Info
     22 0.553677       192.168.2.1           239.255.255.250       SSDP     359    NOTIFY * HTTP/1.1 

Frame 22: 359 bytes on wire (2872 bits), 359 bytes captured (2872 bits) on interface en0, id 0
Ethernet II, Src: Sagemcom_ff:a3:b2 (34:5d:9e:ff:a3:b2), Dst: IPv4mcast_7f:ff:fa (01:00:5e:7f:ff:fa)
Internet Protocol Version 4, Src: 192.168.2.1, Dst: 239.255.255.250
User Datagram Protocol, Src Port: 1900, Dst Port: 1900
Simple Service Discovery Protocol

No.     Time           Source                Destination           Protocol Length Info
     23 0.554155       192.168.2.34          192.168.2.255         UDP      56     2007 → 2007 Len=14

Frame 23: 56 bytes on wire (448 bits), 56 bytes captured (448 bits) on interface en0, id 0
Ethernet II, Src: IntelCor_11:80:23 (60:dd:8e:11:80:23), Dst: Broadcast (ff:ff:ff:ff:ff:ff)
Internet Protocol Version 4, Src: 192.168.2.34, Dst: 192.168.2.255
User Datagram Protocol, Src Port: 2007, Dst Port: 2007
Data (14 bytes)

0000  42 43 20 20 39 41 73 68 70 61 6e 2d 50 43         BC  9Ashpan-PC

No.     Time           Source                Destination           Protocol Length Info
     24 0.554606       192.168.2.57          224.0.0.251           MDNS     219    Standard query 0x0000 PTR _homekit._tcp.local, "QU" question PTR _hap._tcp.local, "QU" question PTR _companion-link._tcp.local, "QU" question PTR _hap._udp.local, "QU" question TXT 10DCA889-56D5-595B-9744-75C318BD6A43._homekit._tcp.local, "QU" question PTR _sleep-proxy._udp.local, "QU" question OPT

Frame 24: 219 bytes on wire (1752 bits), 219 bytes captured (1752 bits) on interface en0, id 0
Ethernet II, Src: ae:06:13:5c:c6:3d (ae:06:13:5c:c6:3d), Dst: IPv4mcast_fb (01:00:5e:00:00:fb)
Internet Protocol Version 4, Src: 192.168.2.57, Dst: 224.0.0.251
User Datagram Protocol, Src Port: 5353, Dst Port: 5353
Multicast Domain Name System (query)

No.     Time           Source                Destination           Protocol Length Info
     25 0.557542       fe80::c9c:fe23:5a1f:f584 ff02::fb              MDNS     239    Standard query 0x0000 PTR _homekit._tcp.local, "QU" question PTR _hap._tcp.local, "QU" question PTR _companion-link._tcp.local, "QU" question PTR _hap._udp.local, "QU" question TXT 10DCA889-56D5-595B-9744-75C318BD6A43._homekit._tcp.local, "QU" question PTR _sleep-proxy._udp.local, "QU" question OPT

Frame 25: 239 bytes on wire (1912 bits), 239 bytes captured (1912 bits) on interface en0, id 0
Ethernet II, Src: ae:06:13:5c:c6:3d (ae:06:13:5c:c6:3d), Dst: IPv6mcast_fb (33:33:00:00:00:fb)
Internet Protocol Version 6, Src: fe80::c9c:fe23:5a1f:f584, Dst: ff02::fb
User Datagram Protocol, Src Port: 5353, Dst Port: 5353
Multicast Domain Name System (query)

No.     Time           Source                Destination           Protocol Length Info
     26 0.557543       192.168.2.57          224.0.0.251           IGMPv2   52     Membership Report group 224.0.0.251

Frame 26: 52 bytes on wire (416 bits), 52 bytes captured (416 bits) on interface en0, id 0
Ethernet II, Src: ae:06:13:5c:c6:3d (ae:06:13:5c:c6:3d), Dst: IPv4mcast_fb (01:00:5e:00:00:fb)
Internet Protocol Version 4, Src: 192.168.2.57, Dst: 224.0.0.251
Internet Group Management Protocol

No.     Time           Source                Destination           Protocol Length Info
     27 0.655920       192.168.2.1           239.255.255.250       SSDP     411    NOTIFY * HTTP/1.1 

Frame 27: 411 bytes on wire (3288 bits), 411 bytes captured (3288 bits) on interface en0, id 0
Ethernet II, Src: Sagemcom_ff:a3:b2 (34:5d:9e:ff:a3:b2), Dst: IPv4mcast_7f:ff:fa (01:00:5e:7f:ff:fa)
Internet Protocol Version 4, Src: 192.168.2.1, Dst: 239.255.255.250
User Datagram Protocol, Src Port: 1900, Dst Port: 1900
Simple Service Discovery Protocol

No.     Time           Source                Destination           Protocol Length Info
     28 0.655922       192.168.2.34          192.168.2.255         UDP      56     2008 → 2008 Len=14

Frame 28: 56 bytes on wire (448 bits), 56 bytes captured (448 bits) on interface en0, id 0
Ethernet II, Src: IntelCor_11:80:23 (60:dd:8e:11:80:23), Dst: Broadcast (ff:ff:ff:ff:ff:ff)
Internet Protocol Version 4, Src: 192.168.2.34, Dst: 192.168.2.255
User Datagram Protocol, Src Port: 2008, Dst Port: 2008
Data (14 bytes)

0000  42 43 20 20 39 41 73 68 70 61 6e 2d 50 43         BC  9Ashpan-PC

No.     Time           Source                Destination           Protocol Length Info
     29 0.655972       192.168.2.34          192.168.2.255         UDP      56     2007 → 2007 Len=14

Frame 29: 56 bytes on wire (448 bits), 56 bytes captured (448 bits) on interface en0, id 0
Ethernet II, Src: IntelCor_11:80:23 (60:dd:8e:11:80:23), Dst: Broadcast (ff:ff:ff:ff:ff:ff)
Internet Protocol Version 4, Src: 192.168.2.34, Dst: 192.168.2.255
User Datagram Protocol, Src Port: 2007, Dst Port: 2007
Data (14 bytes)

0000  42 43 20 20 39 41 73 68 70 61 6e 2d 50 43         BC  9Ashpan-PC

No.     Time           Source                Destination           Protocol Length Info
     30 0.656865       192.168.2.1           239.255.255.250       SSDP     423    NOTIFY * HTTP/1.1 

Frame 30: 423 bytes on wire (3384 bits), 423 bytes captured (3384 bits) on interface en0, id 0
Ethernet II, Src: Sagemcom_ff:a3:b2 (34:5d:9e:ff:a3:b2), Dst: IPv4mcast_7f:ff:fa (01:00:5e:7f:ff:fa)
Internet Protocol Version 4, Src: 192.168.2.1, Dst: 239.255.255.250
User Datagram Protocol, Src Port: 1900, Dst Port: 1900
Simple Service Discovery Protocol

No.     Time           Source                Destination           Protocol Length Info
     31 0.736219       192.168.2.18          192.168.2.57          MDNS     422    Standard query response 0x0000 PTR Ashpan’s MacBook Air._companion-link._tcp.local SRV, cache flush 0 0 49266 Ashpans-MacBook-Air.local TXT, cache flush TXT AAAA, cache flush fe80::1c92:12f0:877f:9c8b A, cache flush 192.168.2.18

Frame 31: 422 bytes on wire (3376 bits), 422 bytes captured (3376 bits) on interface en0, id 0
Ethernet II, Src: Apple_52:e7:4f (1c:57:dc:52:e7:4f), Dst: ae:06:13:5c:c6:3d (ae:06:13:5c:c6:3d)
Internet Protocol Version 4, Src: 192.168.2.18, Dst: 192.168.2.57
User Datagram Protocol, Src Port: 5353, Dst Port: 5353
Multicast Domain Name System (response)

No.     Time           Source                Destination           Protocol Length Info
     32 0.758376       192.168.2.1           239.255.255.250       SSDP     425    NOTIFY * HTTP/1.1 

Frame 32: 425 bytes on wire (3400 bits), 425 bytes captured (3400 bits) on interface en0, id 0
Ethernet II, Src: Sagemcom_ff:a3:b2 (34:5d:9e:ff:a3:b2), Dst: IPv4mcast_7f:ff:fa (01:00:5e:7f:ff:fa)
Internet Protocol Version 4, Src: 192.168.2.1, Dst: 239.255.255.250
User Datagram Protocol, Src Port: 1900, Dst Port: 1900
Simple Service Discovery Protocol

No.     Time           Source                Destination           Protocol Length Info
     33 0.758379       192.168.2.34          192.168.2.255         UDP      56     2008 → 2008 Len=14

Frame 33: 56 bytes on wire (448 bits), 56 bytes captured (448 bits) on interface en0, id 0
Ethernet II, Src: IntelCor_11:80:23 (60:dd:8e:11:80:23), Dst: Broadcast (ff:ff:ff:ff:ff:ff)
Internet Protocol Version 4, Src: 192.168.2.34, Dst: 192.168.2.255
User Datagram Protocol, Src Port: 2008, Dst Port: 2008
Data (14 bytes)

0000  42 43 20 20 39 41 73 68 70 61 6e 2d 50 43         BC  9Ashpan-PC

No.     Time           Source                Destination           Protocol Length Info
     34 0.758552       192.168.2.34          192.168.2.255         UDP      56     2007 → 2007 Len=14

Frame 34: 56 bytes on wire (448 bits), 56 bytes captured (448 bits) on interface en0, id 0
Ethernet II, Src: IntelCor_11:80:23 (60:dd:8e:11:80:23), Dst: Broadcast (ff:ff:ff:ff:ff:ff)
Internet Protocol Version 4, Src: 192.168.2.34, Dst: 192.168.2.255
User Datagram Protocol, Src Port: 2007, Dst Port: 2007
Data (14 bytes)

0000  42 43 20 20 39 41 73 68 70 61 6e 2d 50 43         BC  9Ashpan-PC

No.     Time           Source                Destination           Protocol Length Info
     35 0.860663       192.168.2.1           239.255.255.250       SSDP     439    NOTIFY * HTTP/1.1 

Frame 35: 439 bytes on wire (3512 bits), 439 bytes captured (3512 bits) on interface en0, id 0
Ethernet II, Src: Sagemcom_ff:a3:b2 (34:5d:9e:ff:a3:b2), Dst: IPv4mcast_7f:ff:fa (01:00:5e:7f:ff:fa)
Internet Protocol Version 4, Src: 192.168.2.1, Dst: 239.255.255.250
User Datagram Protocol, Src Port: 1900, Dst Port: 1900
Simple Service Discovery Protocol

No.     Time           Source                Destination           Protocol Length Info
     36 0.860962       192.168.2.34          192.168.2.255         UDP      56     2008 → 2008 Len=14

Frame 36: 56 bytes on wire (448 bits), 56 bytes captured (448 bits) on interface en0, id 0
Ethernet II, Src: IntelCor_11:80:23 (60:dd:8e:11:80:23), Dst: Broadcast (ff:ff:ff:ff:ff:ff)
Internet Protocol Version 4, Src: 192.168.2.34, Dst: 192.168.2.255
User Datagram Protocol, Src Port: 2008, Dst Port: 2008
Data (14 bytes)

0000  42 43 20 20 39 41 73 68 70 61 6e 2d 50 43         BC  9Ashpan-PC

No.     Time           Source                Destination           Protocol Length Info
     37 0.861243       192.168.2.34          192.168.2.255         UDP      56     2007 → 2007 Len=14

Frame 37: 56 bytes on wire (448 bits), 56 bytes captured (448 bits) on interface en0, id 0
Ethernet II, Src: IntelCor_11:80:23 (60:dd:8e:11:80:23), Dst: Broadcast (ff:ff:ff:ff:ff:ff)
Internet Protocol Version 4, Src: 192.168.2.34, Dst: 192.168.2.255
User Datagram Protocol, Src Port: 2007, Dst Port: 2007
Data (14 bytes)

0000  42 43 20 20 39 41 73 68 70 61 6e 2d 50 43         BC  9Ashpan-PC

No.     Time           Source                Destination           Protocol Length Info
     38 0.880090       192.168.2.18          192.168.2.51          TCP      176    49302 → 8009 [PSH, ACK] Seq=1 Ack=1 Win=2048 Len=110 TSval=3113959613 TSecr=313851842 [TCP segment of a reassembled PDU]

Frame 38: 176 bytes on wire (1408 bits), 176 bytes captured (1408 bits) on interface en0, id 0
Ethernet II, Src: Apple_52:e7:4f (1c:57:dc:52:e7:4f), Dst: Google_ac:cc:2d (cc:f4:11:ac:cc:2d)
Internet Protocol Version 4, Src: 192.168.2.18, Dst: 192.168.2.51
Transmission Control Protocol, Src Port: 49302, Dst Port: 8009, Seq: 1, Ack: 1, Len: 110

No.     Time           Source                Destination           Protocol Length Info
     39 0.884157       192.168.2.51          192.168.2.18          TCP      176    8009 → 49302 [PSH, ACK] Seq=1 Ack=111 Win=771 Len=110 TSval=313856867 TSecr=3113959613 [TCP segment of a reassembled PDU]

Frame 39: 176 bytes on wire (1408 bits), 176 bytes captured (1408 bits) on interface en0, id 0
Ethernet II, Src: Google_ac:cc:2d (cc:f4:11:ac:cc:2d), Dst: Apple_52:e7:4f (1c:57:dc:52:e7:4f)
Internet Protocol Version 4, Src: 192.168.2.51, Dst: 192.168.2.18
Transmission Control Protocol, Src Port: 8009, Dst Port: 49302, Seq: 1, Ack: 111, Len: 110

No.     Time           Source                Destination           Protocol Length Info
     40 0.884261       192.168.2.18          192.168.2.51          TCP      66     49302 → 8009 [ACK] Seq=111 Ack=111 Win=2046 Len=0 TSval=3113959618 TSecr=313856867

Frame 40: 66 bytes on wire (528 bits), 66 bytes captured (528 bits) on interface en0, id 0
Ethernet II, Src: Apple_52:e7:4f (1c:57:dc:52:e7:4f), Dst: Google_ac:cc:2d (cc:f4:11:ac:cc:2d)
Internet Protocol Version 4, Src: 192.168.2.18, Dst: 192.168.2.51
Transmission Control Protocol, Src Port: 49302, Dst Port: 8009, Seq: 111, Ack: 111, Len: 0

No.     Time           Source                Destination           Protocol Length Info
     41 0.962564       192.168.2.34          192.168.2.255         UDP      56     2008 → 2008 Len=14

Frame 41: 56 bytes on wire (448 bits), 56 bytes captured (448 bits) on interface en0, id 0
Ethernet II, Src: IntelCor_11:80:23 (60:dd:8e:11:80:23), Dst: Broadcast (ff:ff:ff:ff:ff:ff)
Internet Protocol Version 4, Src: 192.168.2.34, Dst: 192.168.2.255
User Datagram Protocol, Src Port: 2008, Dst Port: 2008
Data (14 bytes)

0000  42 43 20 20 39 41 73 68 70 61 6e 2d 50 43         BC  9Ashpan-PC

No.     Time           Source                Destination           Protocol Length Info
     42 0.962564       192.168.2.34          192.168.2.255         UDP      56     2007 → 2007 Len=14

Frame 42: 56 bytes on wire (448 bits), 56 bytes captured (448 bits) on interface en0, id 0
Ethernet II, Src: IntelCor_11:80:23 (60:dd:8e:11:80:23), Dst: Broadcast (ff:ff:ff:ff:ff:ff)
Internet Protocol Version 4, Src: 192.168.2.34, Dst: 192.168.2.255
User Datagram Protocol, Src Port: 2007, Dst Port: 2007
Data (14 bytes)

0000  42 43 20 20 39 41 73 68 70 61 6e 2d 50 43         BC  9Ashpan-PC

No.     Time           Source                Destination           Protocol Length Info
     43 1.064996       192.168.2.34          192.168.2.255         UDP      56     2008 → 2008 Len=14

Frame 43: 56 bytes on wire (448 bits), 56 bytes captured (448 bits) on interface en0, id 0
Ethernet II, Src: IntelCor_11:80:23 (60:dd:8e:11:80:23), Dst: Broadcast (ff:ff:ff:ff:ff:ff)
Internet Protocol Version 4, Src: 192.168.2.34, Dst: 192.168.2.255
User Datagram Protocol, Src Port: 2008, Dst Port: 2008
Data (14 bytes)

0000  42 43 20 20 39 41 73 68 70 61 6e 2d 50 43         BC  9Ashpan-PC

No.     Time           Source                Destination           Protocol Length Info
     44 1.064997       192.168.2.34          192.168.2.255         UDP      56     2007 → 2007 Len=14

Frame 44: 56 bytes on wire (448 bits), 56 bytes captured (448 bits) on interface en0, id 0
Ethernet II, Src: IntelCor_11:80:23 (60:dd:8e:11:80:23), Dst: Broadcast (ff:ff:ff:ff:ff:ff)
Internet Protocol Version 4, Src: 192.168.2.34, Dst: 192.168.2.255
User Datagram Protocol, Src Port: 2007, Dst Port: 2007
Data (14 bytes)

0000  42 43 20 20 39 41 73 68 70 61 6e 2d 50 43         BC  9Ashpan-PC

No.     Time           Source                Destination           Protocol Length Info
     45 1.133293       192.168.2.18          192.168.2.21          TCP      176    49283 → 8009 [PSH, ACK] Seq=1 Ack=1 Win=2048 Len=110 TSval=2752552412 TSecr=3730515535 [TCP segment of a reassembled PDU]

Frame 45: 176 bytes on wire (1408 bits), 176 bytes captured (1408 bits) on interface en0, id 0
Ethernet II, Src: Apple_52:e7:4f (1c:57:dc:52:e7:4f), Dst: Google_06:d5:51 (d4:f5:47:06:d5:51)
Internet Protocol Version 4, Src: 192.168.2.18, Dst: 192.168.2.21
Transmission Control Protocol, Src Port: 49283, Dst Port: 8009, Seq: 1, Ack: 1, Len: 110

No.     Time           Source                Destination           Protocol Length Info
     46 1.136353       192.168.2.18          192.168.2.25          TCP      176    49280 → 8009 [PSH, ACK] Seq=1 Ack=1 Win=2048 Len=110 TSval=299137601 TSecr=776555241 [TCP segment of a reassembled PDU]

Frame 46: 176 bytes on wire (1408 bits), 176 bytes captured (1408 bits) on interface en0, id 0
Ethernet II, Src: Apple_52:e7:4f (1c:57:dc:52:e7:4f), Dst: Google_89:d0:7e (f8:0f:f9:89:d0:7e)
Internet Protocol Version 4, Src: 192.168.2.18, Dst: 192.168.2.25
Transmission Control Protocol, Src Port: 49280, Dst Port: 8009, Seq: 1, Ack: 1, Len: 110

No.     Time           Source                Destination           Protocol Length Info
     47 1.141642       192.168.2.21          192.168.2.18          TCP      176    8009 → 49283 [PSH, ACK] Seq=1 Ack=111 Win=503 Len=110 TSval=3730520556 TSecr=2752552412 [TCP segment of a reassembled PDU]

Frame 47: 176 bytes on wire (1408 bits), 176 bytes captured (1408 bits) on interface en0, id 0
Ethernet II, Src: Google_06:d5:51 (d4:f5:47:06:d5:51), Dst: Apple_52:e7:4f (1c:57:dc:52:e7:4f)
Internet Protocol Version 4, Src: 192.168.2.21, Dst: 192.168.2.18
Transmission Control Protocol, Src Port: 8009, Dst Port: 49283, Seq: 1, Ack: 111, Len: 110

No.     Time           Source                Destination           Protocol Length Info
     48 1.141643       192.168.2.25          192.168.2.18          TCP      176    8009 → 49280 [PSH, ACK] Seq=1 Ack=111 Win=503 Len=110 TSval=776560246 TSecr=299137601 [TCP segment of a reassembled PDU]

Frame 48: 176 bytes on wire (1408 bits), 176 bytes captured (1408 bits) on interface en0, id 0
Ethernet II, Src: Google_89:d0:7e (f8:0f:f9:89:d0:7e), Dst: Apple_52:e7:4f (1c:57:dc:52:e7:4f)
Internet Protocol Version 4, Src: 192.168.2.25, Dst: 192.168.2.18
Transmission Control Protocol, Src Port: 8009, Dst Port: 49280, Seq: 1, Ack: 111, Len: 110

No.     Time           Source                Destination           Protocol Length Info
     49 1.141739       192.168.2.18          192.168.2.25          TCP      66     49280 → 8009 [ACK] Seq=111 Ack=111 Win=2046 Len=0 TSval=299137606 TSecr=776560246

Frame 49: 66 bytes on wire (528 bits), 66 bytes captured (528 bits) on interface en0, id 0
Ethernet II, Src: Apple_52:e7:4f (1c:57:dc:52:e7:4f), Dst: Google_89:d0:7e (f8:0f:f9:89:d0:7e)
Internet Protocol Version 4, Src: 192.168.2.18, Dst: 192.168.2.25
Transmission Control Protocol, Src Port: 49280, Dst Port: 8009, Seq: 111, Ack: 111, Len: 0

No.     Time           Source                Destination           Protocol Length Info
     50 1.141796       192.168.2.18          192.168.2.21          TCP      66     49283 → 8009 [ACK] Seq=111 Ack=111 Win=2046 Len=0 TSval=2752552420 TSecr=3730520556

Frame 50: 66 bytes on wire (528 bits), 66 bytes captured (528 bits) on interface en0, id 0
Ethernet II, Src: Apple_52:e7:4f (1c:57:dc:52:e7:4f), Dst: Google_06:d5:51 (d4:f5:47:06:d5:51)
Internet Protocol Version 4, Src: 192.168.2.18, Dst: 192.168.2.21
Transmission Control Protocol, Src Port: 49283, Dst Port: 8009, Seq: 111, Ack: 111, Len: 0

No.     Time           Source                Destination           Protocol Length Info
     51 1.167322       192.168.2.34          192.168.2.255         UDP      56     2008 → 2008 Len=14

Frame 51: 56 bytes on wire (448 bits), 56 bytes captured (448 bits) on interface en0, id 0
Ethernet II, Src: IntelCor_11:80:23 (60:dd:8e:11:80:23), Dst: Broadcast (ff:ff:ff:ff:ff:ff)
Internet Protocol Version 4, Src: 192.168.2.34, Dst: 192.168.2.255
User Datagram Protocol, Src Port: 2008, Dst Port: 2008
Data (14 bytes)

0000  42 43 20 20 39 41 73 68 70 61 6e 2d 50 43         BC  9Ashpan-PC

No.     Time           Source                Destination           Protocol Length Info
     52 1.167468       192.168.2.34          192.168.2.255         UDP      56     2007 → 2007 Len=14

Frame 52: 56 bytes on wire (448 bits), 56 bytes captured (448 bits) on interface en0, id 0
Ethernet II, Src: IntelCor_11:80:23 (60:dd:8e:11:80:23), Dst: Broadcast (ff:ff:ff:ff:ff:ff)
Internet Protocol Version 4, Src: 192.168.2.34, Dst: 192.168.2.255
User Datagram Protocol, Src Port: 2007, Dst Port: 2007
Data (14 bytes)

0000  42 43 20 20 39 41 73 68 70 61 6e 2d 50 43         BC  9Ashpan-PC

No.     Time           Source                Destination           Protocol Length Info
     53 1.375946       192.168.2.34          192.168.2.255         UDP      56     2008 → 2008 Len=14

Frame 53: 56 bytes on wire (448 bits), 56 bytes captured (448 bits) on interface en0, id 0
Ethernet II, Src: IntelCor_11:80:23 (60:dd:8e:11:80:23), Dst: Broadcast (ff:ff:ff:ff:ff:ff)
Internet Protocol Version 4, Src: 192.168.2.34, Dst: 192.168.2.255
User Datagram Protocol, Src Port: 2008, Dst Port: 2008
Data (14 bytes)

0000  42 43 20 20 39 41 73 68 70 61 6e 2d 50 43         BC  9Ashpan-PC

No.     Time           Source                Destination           Protocol Length Info
     54 1.375996       192.168.2.34          192.168.2.255         UDP      56     2007 → 2007 Len=14

Frame 54: 56 bytes on wire (448 bits), 56 bytes captured (448 bits) on interface en0, id 0
Ethernet II, Src: IntelCor_11:80:23 (60:dd:8e:11:80:23), Dst: Broadcast (ff:ff:ff:ff:ff:ff)
Internet Protocol Version 4, Src: 192.168.2.34, Dst: 192.168.2.255
User Datagram Protocol, Src Port: 2007, Dst Port: 2007
Data (14 bytes)

0000  42 43 20 20 39 41 73 68 70 61 6e 2d 50 43         BC  9Ashpan-PC

No.     Time           Source                Destination           Protocol Length Info
     55 1.432373       192.168.2.18          142.251.41.74         UDP      75     63794 → 443 Len=33

Frame 55: 75 bytes on wire (600 bits), 75 bytes captured (600 bits) on interface en0, id 0
Ethernet II, Src: Apple_52:e7:4f (1c:57:dc:52:e7:4f), Dst: Sagemcom_ff:a3:b2 (34:5d:9e:ff:a3:b2)
Internet Protocol Version 4, Src: 192.168.2.18, Dst: 142.251.41.74
User Datagram Protocol, Src Port: 63794, Dst Port: 443
Data (33 bytes)

0000  46 e1 3a b7 95 08 64 7e 6c 8c f0 36 5a 4d 60 4f   F.:...d~l..6ZM`O
0010  74 21 6d 76 e4 25 7a 4f d5 11 a0 d4 e9 e6 6d aa   t!mv.%zO......m.
0020  67                                                g

No.     Time           Source                Destination           Protocol Length Info
     56 1.472215       192.168.2.18          142.251.41.74         UDP      75     63794 → 443 Len=33

Frame 56: 75 bytes on wire (600 bits), 75 bytes captured (600 bits) on interface en0, id 0
Ethernet II, Src: Apple_52:e7:4f (1c:57:dc:52:e7:4f), Dst: Sagemcom_ff:a3:b2 (34:5d:9e:ff:a3:b2)
Internet Protocol Version 4, Src: 192.168.2.18, Dst: 142.251.41.74
User Datagram Protocol, Src Port: 63794, Dst Port: 443
Data (33 bytes)

0000  5b e1 3a b7 95 08 64 7e 6c b7 b6 15 b7 df 61 38   [.:...d~l.....a8
0010  33 94 0f f7 0e bc e1 83 59 b0 b5 24 2b a8 ce 65   3.......Y..$+..e
0020  9a                                                .

No.     Time           Source                Destination           Protocol Length Info
     57 1.477022       192.168.2.34          192.168.2.255         UDP      56     2007 → 2007 Len=14

Frame 57: 56 bytes on wire (448 bits), 56 bytes captured (448 bits) on interface en0, id 0
Ethernet II, Src: IntelCor_11:80:23 (60:dd:8e:11:80:23), Dst: Broadcast (ff:ff:ff:ff:ff:ff)
Internet Protocol Version 4, Src: 192.168.2.34, Dst: 192.168.2.255
User Datagram Protocol, Src Port: 2007, Dst Port: 2007
Data (14 bytes)

0000  42 43 20 20 39 41 73 68 70 61 6e 2d 50 43         BC  9Ashpan-PC

No.     Time           Source                Destination           Protocol Length Info
     58 1.479584       142.251.41.74         192.168.2.18          UDP      67     443 → 63794 Len=25

Frame 58: 67 bytes on wire (536 bits), 67 bytes captured (536 bits) on interface en0, id 0
Ethernet II, Src: Sagemcom_ff:a3:b2 (34:5d:9e:ff:a3:b2), Dst: Apple_52:e7:4f (1c:57:dc:52:e7:4f)
Internet Protocol Version 4, Src: 142.251.41.74, Dst: 192.168.2.18
User Datagram Protocol, Src Port: 443, Dst Port: 63794
Data (25 bytes)

0000  5b 16 ff e9 63 48 f6 00 fa 16 f7 92 50 b0 3f 97   [...cH......P.?.
0010  1a a0 fb 5c 60 88 62 29 f4                        ...\`.b).

No.     Time           Source                Destination           Protocol Length Info
     59 1.479585       142.251.41.74         192.168.2.18          UDP      68     443 → 63794 Len=26

Frame 59: 68 bytes on wire (544 bits), 68 bytes captured (544 bits) on interface en0, id 0
Ethernet II, Src: Sagemcom_ff:a3:b2 (34:5d:9e:ff:a3:b2), Dst: Apple_52:e7:4f (1c:57:dc:52:e7:4f)
Internet Protocol Version 4, Src: 142.251.41.74, Dst: 192.168.2.18
User Datagram Protocol, Src Port: 443, Dst Port: 63794
Data (26 bytes)

0000  53 a3 8a 86 99 21 82 01 07 68 4a f8 9b 4d 96 8d   S....!...hJ..M..
0010  ec 39 a5 12 a9 fb a6 9b 8f 08                     .9........

No.     Time           Source                Destination           Protocol Length Info
     60 1.580428       192.168.2.34          192.168.2.255         UDP      56     2008 → 2008 Len=14

Frame 60: 56 bytes on wire (448 bits), 56 bytes captured (448 bits) on interface en0, id 0
Ethernet II, Src: IntelCor_11:80:23 (60:dd:8e:11:80:23), Dst: Broadcast (ff:ff:ff:ff:ff:ff)
Internet Protocol Version 4, Src: 192.168.2.34, Dst: 192.168.2.255
User Datagram Protocol, Src Port: 2008, Dst Port: 2008
Data (14 bytes)

0000  42 43 20 20 39 41 73 68 70 61 6e 2d 50 43         BC  9Ashpan-PC

No.     Time           Source                Destination           Protocol Length Info
     61 1.580430       192.168.2.34          192.168.2.255         UDP      56     2007 → 2007 Len=14

Frame 61: 56 bytes on wire (448 bits), 56 bytes captured (448 bits) on interface en0, id 0
Ethernet II, Src: IntelCor_11:80:23 (60:dd:8e:11:80:23), Dst: Broadcast (ff:ff:ff:ff:ff:ff)
Internet Protocol Version 4, Src: 192.168.2.34, Dst: 192.168.2.255
User Datagram Protocol, Src Port: 2007, Dst Port: 2007
Data (14 bytes)

0000  42 43 20 20 39 41 73 68 70 61 6e 2d 50 43         BC  9Ashpan-PC

No.     Time           Source                Destination           Protocol Length Info
     62 1.580430       192.168.2.57          224.0.0.251           MDNS     310    Standard query 0x0000 PTR _homekit._tcp.local, "QM" question PTR _hap._tcp.local, "QM" question PTR _companion-link._tcp.local, "QM" question PTR _hap._udp.local, "QM" question TXT 10DCA889-56D5-595B-9744-75C318BD6A43._homekit._tcp.local, "QM" question PTR _sleep-proxy._udp.local, "QM" question PTR Dwip’s MacBook Air._companion-link._tcp.local PTR iPad._companion-link._tcp.local PTR Ashpan’s MacBook Air._companion-link._tcp.local OPT

Frame 62: 310 bytes on wire (2480 bits), 310 bytes captured (2480 bits) on interface en0, id 0
Ethernet II, Src: ae:06:13:5c:c6:3d (ae:06:13:5c:c6:3d), Dst: IPv4mcast_fb (01:00:5e:00:00:fb)
Internet Protocol Version 4, Src: 192.168.2.57, Dst: 224.0.0.251
User Datagram Protocol, Src Port: 5353, Dst Port: 5353
Multicast Domain Name System (query)

No.     Time           Source                Destination           Protocol Length Info
     63 1.679485       192.168.2.34          192.168.2.255         UDP      56     2008 → 2008 Len=14

Frame 63: 56 bytes on wire (448 bits), 56 bytes captured (448 bits) on interface en0, id 0
Ethernet II, Src: IntelCor_11:80:23 (60:dd:8e:11:80:23), Dst: Broadcast (ff:ff:ff:ff:ff:ff)
Internet Protocol Version 4, Src: 192.168.2.34, Dst: 192.168.2.255
User Datagram Protocol, Src Port: 2008, Dst Port: 2008
Data (14 bytes)

0000  42 43 20 20 39 41 73 68 70 61 6e 2d 50 43         BC  9Ashpan-PC

No.     Time           Source                Destination           Protocol Length Info
     64 1.679487       192.168.2.34          192.168.2.255         UDP      56     2007 → 2007 Len=14

Frame 64: 56 bytes on wire (448 bits), 56 bytes captured (448 bits) on interface en0, id 0
Ethernet II, Src: IntelCor_11:80:23 (60:dd:8e:11:80:23), Dst: Broadcast (ff:ff:ff:ff:ff:ff)
Internet Protocol Version 4, Src: 192.168.2.34, Dst: 192.168.2.255
User Datagram Protocol, Src Port: 2007, Dst Port: 2007
Data (14 bytes)

0000  42 43 20 20 39 41 73 68 70 61 6e 2d 50 43         BC  9Ashpan-PC

No.     Time           Source                Destination           Protocol Length Info
     65 1.782377       192.168.2.34          192.168.2.255         UDP      56     2008 → 2008 Len=14

Frame 65: 56 bytes on wire (448 bits), 56 bytes captured (448 bits) on interface en0, id 0
Ethernet II, Src: IntelCor_11:80:23 (60:dd:8e:11:80:23), Dst: Broadcast (ff:ff:ff:ff:ff:ff)
Internet Protocol Version 4, Src: 192.168.2.34, Dst: 192.168.2.255
User Datagram Protocol, Src Port: 2008, Dst Port: 2008
Data (14 bytes)

0000  42 43 20 20 39 41 73 68 70 61 6e 2d 50 43         BC  9Ashpan-PC

No.     Time           Source                Destination           Protocol Length Info
     66 1.782379       192.168.2.34          192.168.2.255         UDP      56     2007 → 2007 Len=14

Frame 66: 56 bytes on wire (448 bits), 56 bytes captured (448 bits) on interface en0, id 0
Ethernet II, Src: IntelCor_11:80:23 (60:dd:8e:11:80:23), Dst: Broadcast (ff:ff:ff:ff:ff:ff)
